{
  "receipt_id": "7c9e6679-7425-40de-944b-e07fc1f90ae7",
  "routing_id": "ad9443a8-c1da-48a3-bc38-e87a03d42350",
  "filename": "route_smoke.txt",
  "received_at": "2025-12-17T21:16:36.000Z",
  "received_by": "agent1",
  "status": "accepted",
  "notes": "Checksum validated",
  "contract_version": "1.0"
}
